<?xml version="1.0" encoding="UTF-8"?>
<!--Parameter zur SVG-Visualisierung eines Regionalen Entwicklungsplans Rheinland-Pfalz-->

<SvgVisualisierung xmlns:xsi="http://www.w3.org/2001/XMLSchema-instance"
 xsi:noNamespaceSchemaLocation="SvgParameter.xsd"
 gmlType="XPlanGML"
 Masstab="1:2000"
 datum="2009-09-18"
 breiteUeberschrift="800"
 hoeheUeberschrift="30"
 gmlVersion="4.0">
    
    <!--RP_Plan -->
    <GmlKlassenVisual gmlKlassenName="RP_Plan" priorityFlaechendarstellung="50">
        <FlaechenDarstellung default="true">
            <FlaechenParams class="RpRaeumlicherGeltungsbereichA" clip="false"/>
            <FlaechenParams class="RpRaeumlicherGeltungsbereichB" clip="false"/>
        </FlaechenDarstellung>
    </GmlKlassenVisual>        
    
    <Style styleName="RpRaeumlicherGeltungsbereichA">
        <FillColor>
            <None/>
        </FillColor>
        <StrokeColor>
            <Color r="0" g="0" b="0"/>
        </StrokeColor>
        <Stroke-width>4</Stroke-width>
        <Stroke-dasharray>10</Stroke-dasharray>
        <Stroke-dasharray>3</Stroke-dasharray>
        <Stroke-dashoffset>1</Stroke-dashoffset>
    </Style>
    
    <Style styleName="RpRaeumlicherGeltungsbereichB">
        <FillColor>
            <None/>
        </FillColor>
        <StrokeColor>
            <ColorName>black</ColorName>
        </StrokeColor>
        <Stroke-width>0.5</Stroke-width>
    </Style>
    
    <!-- RP_RLP_ZentrlerOrtBesondFunktion Punktdarstellung -->
    <GmlKlassenVisual gmlKlassenName="RP_RLP_ZentralerOrtBesondFunktion"  priorityPunktdarstellung="30" selectAttribut1="funktion" selectAttribut2="netzTyp">
        <PunktDarstellung symbol="SymbolOberzentrum" >
            <SelectAttributWert1>1000</SelectAttributWert1>
            <SelectAttributWert2>IIII</SelectAttributWert2>
        </PunktDarstellung>
        
        <PunktDarstellung symbol="SymbolMittelzentrumGrundnetz">
            <SelectAttributWert1>2000</SelectAttributWert1>
            <SelectAttributWert2>1000</SelectAttributWert2>
        </PunktDarstellung>
        
        <PunktDarstellung symbol="SymbolMittelzentrumErgaenzungsnetz">
            <SelectAttributWert1>2000</SelectAttributWert1>
            <SelectAttributWert2>2000</SelectAttributWert2>
        </PunktDarstellung>
             
        <PunktDarstellung symbol="SymbolGrundzentrum">
            <SelectAttributWert1>3000</SelectAttributWert1>
            <SelectAttributWert2>NNNN</SelectAttributWert2>
        </PunktDarstellung>       
        
        <PunktDarstellung symbol="SymbolGrundzentrumGrundnetz">
            <SelectAttributWert1>3000</SelectAttributWert1>
            <SelectAttributWert2>1000</SelectAttributWert2>
        </PunktDarstellung>  
        
        <PunktDarstellung symbol="SymbolGrundzentrumErgaenzungsnetz">
            <SelectAttributWert1>3000</SelectAttributWert1>
            <SelectAttributWert2>2000</SelectAttributWert2>
        </PunktDarstellung>       
    </GmlKlassenVisual>
    
    <Symbol name="SymbolOberzentrum">
        <Rect  x="-10" y="-10"  width="20" height="20">
            <FillColor>
                <ColorName>red</ColorName>
            </FillColor>
            <StrokeColor>
                <None>/</None>
            </StrokeColor>
        </Rect>
        
        <Rect x="-7.5" y="-7.5"  width="15" height="15">
            <FillColor>
                <ColorName>white</ColorName>
            </FillColor>
            <StrokeColor>
                <None/>
            </StrokeColor>
        </Rect> 
        
        <Rect x="-5" y="-5" width="10" height="10">
            <FillColor>
                 <ColorName>red</ColorName>
            </FillColor>
            <StrokeColor>
                <None/>
            </StrokeColor>
        </Rect>
    </Symbol>
    
    <Symbol name="SymbolMittelzentrumGrundnetz">
        <Rect x="-5" y="-5" width="10" height="10">
            <FillColor>
                <ColorName>red</ColorName>
            </FillColor>
            <StrokeColor>
                <None/>
            </StrokeColor>
        </Rect>        
    </Symbol>
    
    <Symbol name="SymbolMittelzentrumErgaenzungsnetz">
        <Rect x="-4" y="-4" width="8" height="8">
            <FillColor>
           <ColorName>white</ColorName>
            </FillColor>
            <StrokeColor>
               <ColorName>red</ColorName>
            </StrokeColor>
            <Stroke-width>2</Stroke-width>
        </Rect>        
        
       
    </Symbol>
    
    <Symbol name="SymbolGrundzentrum">
        <Circle cx="0" cy="0" r="4">
            <FillColor>
                <ColorName>red</ColorName>
            </FillColor>
            <StrokeColor>
                <None/>
            </StrokeColor>
        </Circle>
    </Symbol>
    
    <Symbol name="SymbolGrundzentrumGrundnetz">
        <Circle cx="0" cy="0" r="4">
            <FillColor>
                <ColorName>red</ColorName>
            </FillColor>
            <StrokeColor>
                <None/>
            </StrokeColor>
        </Circle>
    </Symbol>
    
    <Symbol name="SymbolGrundzentrumErgaenzungsnetz">
        <Circle cx="0" cy="0" r="3.5">
            <FillColor>
                <ColorName>white</ColorName>
            </FillColor>
            <StrokeColor>
              <ColorName>red</ColorName>
            </StrokeColor>
            <Stroke-width>1</Stroke-width>
        </Circle>
    </Symbol>
    
    <!--  RP_RLP_Raumkategorie -->
    <GmlKlassenVisual gmlKlassenName="RP_RLP_Raumkategorie" priorityFlaechendarstellung="10" priorityPunktdarstellung="30" selectAttribut1="typ">
        <FlaechenDarstellung deckend="true">
            <SelectAttributWert1>1000</SelectAttributWert1>
            <FlaechenParams class="RP-RLP-RaumkategorieFlaechenStyle" clip="true"/>
        </FlaechenDarstellung>
        
        <PunktDarstellung symbol="SymbolFunktionsraum">
            <SelectAttributWert1>1000</SelectAttributWert1>
        </PunktDarstellung>
    </GmlKlassenVisual>
    
    <Style styleName="RP-RLP-RaumkategorieFlaechenStyle">
        <FillColor>
            <None/>
        </FillColor>
        <StrokeColor>
            <ColorName>red</ColorName>
        </StrokeColor>
        <Stroke-width>2</Stroke-width>
    </Style>
    
    <Symbol name="SymbolFunktionsraum">
        <Rect x="-9.5" y="-4.5" width="19" height="9">
            <FillColor>
                <ColorName>white</ColorName>
            </FillColor>
            <StrokeColor>
                <ColorName>red</ColorName>
            </StrokeColor>
            <Stroke-width>1</Stroke-width>
        </Rect>
    </Symbol>
    
    <GmlKlassenVisual gmlKlassenName="RP_RLP_Siedlungsstruktur" priorityFlaechendarstellung="10" selectAttribut2="rechtsstand" selectAttribut3="gebietsTyp" selectAttribut1="typ">
        <FlaechenDarstellung deckend="true">
            <SelectAttributWert1>1000</SelectAttributWert1>
            <SelectAttributWert2>NNNN</SelectAttributWert2>
            <SelectAttributWert3>NNNN</SelectAttributWert3>
            <FlaechenParams class="RP-RLP-SiedlungflaecheWohnenStyle" clip="false"/>
        </FlaechenDarstellung>
        
        <FlaechenDarstellung deckend="true">
            <SelectAttributWert1>1000</SelectAttributWert1> 
            <SelectAttributWert2>2000</SelectAttributWert2>
            <SelectAttributWert3>NNNN</SelectAttributWert3>
            <FlaechenParams class="RP-RLP-SiedlungflaecheWohnenBestandStyle" clip="false"/>
        </FlaechenDarstellung>
        
        <FlaechenDarstellung deckend="true">
            <SelectAttributWert1>1000</SelectAttributWert1>
            <SelectAttributWert2>1000</SelectAttributWert2>
            <SelectAttributWert3>NNNN</SelectAttributWert3>
            <FlaechenParams class="RP-RLP-SiedlungflaecheWohnenPlanungStyle" clip="false"/>
        </FlaechenDarstellung>        
        
        <FlaechenDarstellung deckend="true" priority="12">
            <SelectAttributWert1>1000</SelectAttributWert1>
            <SelectAttributWert2>IIII</SelectAttributWert2>
            <SelectAttributWert3>1000</SelectAttributWert3>
            <FlaechenParams hatching="VorranggebietWohnenHatch" clip="false"/>
        </FlaechenDarstellung>
        
        <FlaechenDarstellung deckend="true" priority="12">
            <SelectAttributWert1>1000</SelectAttributWert1>
            <SelectAttributWert2>IIII</SelectAttributWert2>
            <SelectAttributWert3>2000</SelectAttributWert3>
            <FlaechenParams hatching="VorbehaltsgebietWohnenHatch" clip="false"/>
        </FlaechenDarstellung>
               
        <FlaechenDarstellung deckend="true">
            <SelectAttributWert1>2000</SelectAttributWert1>
            <SelectAttributWert2>NNNN</SelectAttributWert2>
            <SelectAttributWert3>NNNN</SelectAttributWert3>
            <FlaechenParams class="RP-RLP-SiedlungflaecheIndustrieGewerbeStyle" clip="false"/>
        </FlaechenDarstellung>
        
        <FlaechenDarstellung deckend="true">
            <SelectAttributWert1>2000</SelectAttributWert1>
            <SelectAttributWert2>2000</SelectAttributWert2>
            <SelectAttributWert3>NNNN</SelectAttributWert3>
            <FlaechenParams class="RP-RLP-SiedlungflaecheIndustrieGewerbeBestandStyle" clip="false"/>
        </FlaechenDarstellung>
        
        <FlaechenDarstellung deckend="true">
            <SelectAttributWert1>2000</SelectAttributWert1>
            <SelectAttributWert2>1000</SelectAttributWert2>
            <SelectAttributWert3>NNNN</SelectAttributWert3>
            <FlaechenParams class="RP-RLP-SiedlungflaecheIndustrieGewerbePlanungStyle" clip="false"/>
        </FlaechenDarstellung>